{
  "schemaVersion": 1,
  "briefVersion": 1,
  "date": "YYYY-MM-DD",
  "reviewer": {
    "name": "",
    "qualifications": "",
    "interestsDeclared": "none",
    "signatureArtifact": "cultural-review-signed.pdf"
  },
  "questions": {
    "Q1": {
      "_subject": "Four Rivers 四瀆 — the 目/口 lineage disagreement. Carry both, or select one?",
      "verdict": "approved | revise | rejected",
      "rationale": "",
      "contestedInterpretations": [
        {
          "claim": "",
          "sources": [
            ""
          ],
          "reviewerView": "",
          "ourHandlingMisrepresents": false
        }
      ],
      "wordingDecisions": [
        {
          "current": "",
          "required": "",
          "note": ""
        }
      ]
    },
    "Q2": {
      "_subject": "五官 — physiognomic membership (with 眉) or Neijing membership (with 舌)?",
      "verdict": "approved | revise | rejected",
      "rationale": "",
      "contestedInterpretations": [
        {
          "claim": "",
          "sources": [
            ""
          ],
          "reviewerView": "",
          "ourHandlingMisrepresents": false
        }
      ],
      "wordingDecisions": [
        {
          "current": "",
          "required": "",
          "note": ""
        }
      ]
    },
    "Q3": {
      "_subject": "Twelve Palaces — 妻妾宮 and 奴僕宮: suppress, show literally, or modernise?",
      "verdict": "approved | revise | rejected",
      "rationale": "",
      "contestedInterpretations": [
        {
          "claim": "",
          "sources": [
            ""
          ],
          "reviewerView": "",
          "ourHandlingMisrepresents": false
        }
      ],
      "wordingDecisions": [
        {
          "current": "",
          "required": "",
          "note": ""
        }
      ]
    },
    "Q4": {
      "_subject": "Colour 五色 as a Five Elements classifier input — is what remains still 五形人?",
      "verdict": "approved | revise | rejected",
      "rationale": "",
      "contestedInterpretations": [
        {
          "claim": "",
          "sources": [
            ""
          ],
          "reviewerView": "",
          "ourHandlingMisrepresents": false
        }
      ],
      "wordingDecisions": [
        {
          "current": "",
          "required": "",
          "note": ""
        }
      ]
    }
  },
  "families": {
    "five-elements-v1": {
      "_subject": "Five Elements 五形人",
      "verdict": "approved | revise | rejected",
      "rationale": "",
      "contestedInterpretations": [
        {
          "claim": "",
          "sources": [
            ""
          ],
          "reviewerView": "",
          "ourHandlingMisrepresents": false
        }
      ],
      "wordingDecisions": [
        {
          "current": "",
          "required": "",
          "note": ""
        }
      ]
    },
    "three-courts-v1": {
      "_subject": "Three Sections 三停 (formerly 'Three Courts')",
      "verdict": "approved | revise | rejected",
      "rationale": "",
      "contestedInterpretations": [
        {
          "claim": "",
          "sources": [
            ""
          ],
          "reviewerView": "",
          "ourHandlingMisrepresents": false
        }
      ],
      "wordingDecisions": [
        {
          "current": "",
          "required": "",
          "note": ""
        }
      ]
    },
    "twelve-palaces-v1": {
      "_subject": "Twelve Palaces 十二宮",
      "verdict": "approved | revise | rejected",
      "rationale": "",
      "contestedInterpretations": [
        {
          "claim": "",
          "sources": [
            ""
          ],
          "reviewerView": "",
          "ourHandlingMisrepresents": false
        }
      ],
      "wordingDecisions": [
        {
          "current": "",
          "required": "",
          "note": ""
        }
      ]
    },
    "qi-se-reading-v1": {
      "_subject": "Qi Se reading",
      "verdict": "approved | revise | rejected",
      "rationale": "",
      "contestedInterpretations": [
        {
          "claim": "",
          "sources": [
            ""
          ],
          "reviewerView": "",
          "ourHandlingMisrepresents": false
        }
      ],
      "wordingDecisions": [
        {
          "current": "",
          "required": "",
          "note": ""
        }
      ]
    },
    "harmony-v1": {
      "_subject": "Proportion harmony (reclassified as a computed score, R2)",
      "verdict": "approved | revise | rejected",
      "rationale": "",
      "contestedInterpretations": [
        {
          "claim": "",
          "sources": [
            ""
          ],
          "reviewerView": "",
          "ourHandlingMisrepresents": false
        }
      ],
      "wordingDecisions": [
        {
          "current": "",
          "required": "",
          "note": ""
        }
      ]
    },
    "qise-passages-v1": {
      "_subject": "Composed passages / Reflection corpus",
      "verdict": "approved | revise | rejected",
      "rationale": "",
      "contestedInterpretations": [
        {
          "claim": "",
          "sources": [
            ""
          ],
          "reviewerView": "",
          "ourHandlingMisrepresents": false
        }
      ],
      "wordingDecisions": [
        {
          "current": "",
          "required": "",
          "note": ""
        }
      ]
    }
  }
}
